{
  "request_id": "CRQ-2026-00009",
  "responded_at": "2026-02-22T12:00:00Z",
  "status": "denied",
  "decision": {
    "decision_reason": "Evidence insufficient to modify authoritative registry entry.",
    "reason_codes": [
      "RC_EVIDENCE_INSUFFICIENT"
    ]
  },
  "signature": {
    "alg": "EdDSA",
    "kid": "did:example:registry#key-1",
    "value": "BASE64URLSIG"
  }
}
